{
  "id": "def.nt.divides-relation",
  "entity_type": "definition",
  "schema_version": "1.0.0",
  "status": "published",
  "definition_kind": "definition",
  "primary_topic_id": "nt.divisibility-gcd-prime-factorization",
  "term": "Divisibility",
  "slug": "divisibility",
  "statement": {
    "source_format": "dual",
    "plain_text": "An integer a divides b if b = ak for some integer k.",
    "markdown": "An integer $a$ divides $b$ if $b = ak$ for some integer $k$.",
    "latex": "\\text{An integer } a \\text{ divides } b \\text{ if } b = ak \\text{ for some integer } k.",
    "display_mode": "mixed"
  },
  "tracking_profile": {
    "is_trackable": true,
    "mastery_weight": 0.8,
    "review_priority": "normal",
    "completion_criteria": [
      "read",
      "understand",
      "apply"
    ],
    "estimated_effort_minutes": 20
  },
  "audit": {
    "created_at": "2026-03-08T10:00:00Z",
    "updated_at": "2026-03-08T10:05:00Z",
    "created_by": "system.seed",
    "updated_by": "system.seed"
  }
}
